cluster_id,size,repr_title,repr_url,repr_source,sources,first_published_dt,last_published_dt
105,1,"חייל המילואים אריאל מאיר טמן ז""ל אותר ללא רוח חיים בביתו",https://www.mako.co.il/news-israel/2025_q3/Article-3d128a2b8105891027.htm,n12,n12,2025-07-28T09:46:00+00:00,2025-07-28T09:46:00+00:00
106,1,"ינון מגל: ""חמאס שטנים - חשדהו, חשדהו והשמידהו""",https://www.c14.co.il/article/1298346,channel14,channel14,2025-08-18T19:41:00+00:00,2025-08-18T19:41:00+00:00
107,1,"""זה נראה ממש אמין"": הונאת ה-AI שהפילה רבים בפח",https://www.mako.co.il/news-israel/2025_q3/Article-5164525d1d17891027.htm,n12,n12,2025-08-04T05:40:00+00:00,2025-08-04T05:40:00+00:00
108,1,"""מתוך תחושת שליחות"": חילופי מפקדים בחטיבת פארן",https://www.c14.co.il/article/1288675,channel14,channel14,,
110,1,"רביב דרוקר משקר: הרדיפה נגד ראש השב""כ המיועד דוד זיני",https://www.c14.co.il/article/1289418,channel14,channel14,,
112,1,"הלילה: שריפה פרצה במבנה חקלאי סמוך לאגמון החולה, אין נפגעים",https://www.c14.co.il/article/1289451,channel14,channel14,,
113,1,נקבע מותה של ילדה כבת 4 שנשכחה ברכב,https://www.mako.co.il/news-israel/2025_q3/Article-0be58ff52d8a891026.htm,n12,n12,2025-08-14T15:00:00+00:00,2025-08-14T15:00:00+00:00
114,1,"תרגיל פתע יתקיים לבחינת מוכנות המטכ""ל ומפקדות ראשיות בצה""ל",https://www.c14.co.il/article/1290380,channel14,channel14,2025-08-09T22:36:00+00:00,2025-08-09T22:36:00+00:00
115,1,השחקן אלון אבוטבול התמוטט בחוף הבונים ומת אחרי פעולות החייאה,https://www.mako.co.il/news-israel/2025_q3/Article-7466f8b66f45891027.htm,n12,n12,2025-07-29T08:04:00+00:00,2025-07-29T08:04:00+00:00
117,1,"בשוק ""מחנה יהודה"" טוענים להתעמרות מעיריית ירושלים: ""קשישה עצרה לנוח אצלי בעסק - הפקחים נתנו לי דוח""",https://www.mako.co.il/news-israel/2025_q3/Article-95dea324b6e7891026.htm,n12,n12,2025-08-06T12:09:00+00:00,2025-08-06T12:09:00+00:00
118,1,בחיפוש בצפון השומרון: כוחותינו תפסו רובה ציד עם 800 כדורים,https://www.c14.co.il/article/1288101,channel14,channel14,2025-08-05T19:22:05.577551+00:00,2025-08-05T19:22:05.577551+00:00
119,1,"עודד מנשה: ""צריך להמשיך לחזק את לפיד"" | צפו",https://www.c14.co.il/article/1290611,channel14,channel14,2025-08-10T12:25:16.064351+00:00,2025-08-10T12:25:16.064351+00:00
120,1,"אימו של אוריאל נורי ז""ל שהותקף למוות בידי נמר בריאיון: ""הוא הגיע לגן החיות לא במקרה – החברה נידתה אותו""",https://www.mako.co.il/news-israel/2025_q3/Article-94d86af1e307891026.htm,n12,n12,2025-08-03T15:55:00+00:00,2025-08-03T15:55:00+00:00
123,1,"סתימת הפיות נמשכת: בבית החולים רמב""ם נאסר לצפות בערוץ 14",https://www.c14.co.il/article/1287866,channel14,channel14,2025-08-05T17:55:05.576552+00:00,2025-08-05T17:55:05.576552+00:00
124,1,"זעקת האב לשני לוחמים בעזה שאחד מהם נפצע קשה: ""השחיקה בנפש שלהם נוראית""",https://www.mako.co.il/news-israel/2025_q3/Article-4c961c23e434891026.htm,n12,n12,2025-07-26T14:20:00+00:00,2025-07-26T14:20:00+00:00
125,1,אחרי שנה ו-8 חודשים: רחל מאופקים חוזרת לביתה,https://www.mako.co.il/news-israel/2025_q3/Article-b7d92a642b84891027.htm,n12,n12,2025-07-26T22:54:00+00:00,2025-07-26T22:54:00+00:00
126,1,"בן 75 נעלם עם הרכב - איתוראן סירבו לחשוף את מיקומו: ""היה יכול להגיע לעזה""",https://www.mako.co.il/news-israel/2025_q3/Article-061338cc70b4891027.htm,n12,n12,2025-07-28T12:01:00+00:00,2025-07-28T12:01:00+00:00
127,1,חשד חמור בירושלים: ספר כלבים ביצע מעשים מגונים בקטינות,https://www.c14.co.il/article/1287867,channel14,channel14,2025-08-05T15:55:05.586286+00:00,2025-08-05T15:55:05.586286+00:00
128,1,וואטסאפ יוצאת למלחמה בנוכלים - תוך שימוש ב-ChatGPT,https://www.c14.co.il/article/1288770,channel14,channel14,,
129,1,לוחמינו איתרו והשמידו תוואי תת-קרקעי באורך של כ-2 קילומטרים,https://www.c14.co.il/article/1287943,channel14,channel14,2025-08-05T17:55:05.577551+00:00,2025-08-05T17:55:05.577551+00:00
130,1,"המתפללים הגיעו לבית הכנסת ונדהמו - החשמל נותק: ""העירייה רוצה להוציא אותנו""",https://www.mako.co.il/news-israel/2025_q3/Article-8d8d35c9747b891026.htm,n12,n12,2025-08-17T12:37:00+00:00,2025-08-17T12:37:00+00:00
132,1,"חוסלה החווה ליד פצאל, 262 תנינים נורו למוות",https://www.mako.co.il/news-israel/2025_q3/Article-908bea8c8547891026.htm,n12,n12,2025-08-04T11:14:00+00:00,2025-08-04T11:14:00+00:00
133,1,"""אף אחד לא הקשיב"": מילנה בת ה-12 שמה קץ לחייה, אימה סופדת בכאב",https://www.mako.co.il/news-israel/2025_q3/Article-400a40d5b157891026.htm,n12,n12,2025-08-04T14:20:00+00:00,2025-08-04T14:20:00+00:00
135,1,לוחמי המחזור הראשון של חטיבת חשמונאים סיימו את הכשרתם,https://www.c14.co.il/article/1288837,channel14,channel14,,
136,1,20 שנה אחרי: תושבי היישוב שנעקר בגירוש - חוזרים הביתה,https://www.c14.co.il/article/1289466,channel14,channel14,2025-08-07T10:06:33.355213+00:00,2025-08-07T10:06:33.355213+00:00
137,1,גבר נהרג בהתרסקות מצנח רחיפה ממונע סמוך לחוף ארגמן בנתניה,https://www.mako.co.il/news-israel/2025_q3/Article-d1a452786824891026.htm,n12,n12,2025-07-25T18:40:00+00:00,2025-07-25T18:40:00+00:00
138,1,"682 ימים בשבי - אחותו של ביפין ג'ושי: ""בבקשה אל תשכחו את אחי""",https://www.mako.co.il/news-israel/2025_q3/Article-b764ff5c1abb891027.htm,n12,n12,2025-08-18T06:55:00+00:00,2025-08-18T06:55:00+00:00
