cluster_id,size,repr_title,repr_url,repr_source,sources,first_published_dt,last_published_dt
6,15,אוכל,https://www.c14.co.il/article/1289114,channel14,channel14,2025-08-06T21:30:00+00:00,2025-08-06T21:30:00+00:00
43,12,"""שורף קצת, אבל עושה את העבודה"": הסטנדאפ שקרע את סטורי לילה",https://www.c14.co.il/article/1288454,channel14,channel14,2025-08-06T20:37:24.319230+00:00,2025-08-07T11:06:33.359207+00:00
68,9,"אבי ביטר נגד מכתב האמנים: ""כל העולם שונא אותנו בגללם"" | צפו",https://www.c14.co.il/article/1287446,channel14,channel14,2025-08-05T18:55:05.583865+00:00,2025-08-07T11:06:33.359207+00:00
46,8,הסוף לניחושים: המדריך לביצה המושלמת - מרכה ועד קשה,https://www.c14.co.il/article/1287629,channel14,channel14,2025-08-05T17:55:05.581867+00:00,2025-08-05T17:55:05.582864+00:00
3,7,"בית""ר ירושלים דרסה את הפועל חיפה ועלתה לגמר מול הפועל ת""א",https://www.c14.co.il/article/1298290,channel14,channel14,2025-08-18T18:51:00+00:00,2025-08-18T18:51:00+00:00
15,6,בדקה ה-90: כך חוסל פרויקט דיוק הטילים של חיזבאללה | בלעדי,https://www.c14.co.il/article/1289131,channel14,channel14,2025-08-06T20:04:00+00:00,2025-08-09T20:43:00+00:00
35,6,"""בזכותו אני כאן"": המפגש המרגש בהופעה של עידן עמדי | צפו",https://www.c14.co.il/article/1297024,channel14,channel14,2025-08-19T09:56:32.706899+00:00,2025-08-19T09:56:32.706899+00:00
45,6,בשיא אוגוסט: קווי הרכבת המרכזיים בין חיפה לתל אביב וירושלים יושבתו לכמה ימים,https://www.mako.co.il/news-israel/2025_q3/Article-a5b1eb157cba891026.htm,n12,"channel14, n12",2025-08-15T05:23:00+00:00,2025-08-19T11:35:32.701749+00:00
71,6,"עוגת וניל עם דובדבנים ופיסטוק: רכה, מתוקה ומוכנה ב-10 דקות",https://www.c14.co.il/article/1296627,channel14,channel14,2025-08-19T10:56:32.706899+00:00,2025-08-19T10:56:32.706899+00:00
0,5,"תאונה קשה באזור מצדה: נער בן 16 נהרג, 3 צעירים נפצעו",https://www.mako.co.il/news-israel/2025_q3/Article-1d8dd141a887891027.htm,n12,n12,2025-08-05T05:56:00+00:00,2025-08-16T19:01:00+00:00
40,5,"פרקליט המדינה: ""ההחלטה על סיום כהונת היועמ""שית מנוגדת לדין""",https://www.c14.co.il/article/1287897,channel14,channel14,2025-08-05T16:55:05.580863+00:00,2025-08-07T13:06:33.354212+00:00
58,5,"לרגל ט""ו באב: נועה ארגמני בפוסט מצמרר לבן זוגה המוחזק בשבי",https://www.c14.co.il/article/1290220,channel14,channel14,2025-08-10T12:23:16.068487+00:00,2025-08-10T12:23:16.069489+00:00
13,4,"עינב צנגאוקר חסמה נתיבים באיילון: ""היינו קרובים לעסקה, מדינה שלמה בוכה""",https://www.mako.co.il/news-israel/2025_q3/Article-8cef463167a8891026.htm,n12,n12,2025-08-08T17:57:00+00:00,2025-08-17T05:00:00+00:00
14,4,"מכה לבית""ר: עומר אצילי לא כשיר למשחק הראשון מול ריגה",https://www.c14.co.il/article/1287990,channel14,channel14,2025-08-05T17:05:00+00:00,2025-08-05T17:05:00+00:00
32,4,"""השתיקה הורגת"": משפחות חטופים וחללים הכריזו – משביתים את המשק ביום ראשון",https://www.mako.co.il/news-israel/2025_q3/Article-a1192aa1fa29891026.htm,n12,"channel14, n12",2025-08-10T09:00:00+00:00,2025-08-19T11:36:32.701749+00:00
48,4,"צה""ל: 785 חבילות סיוע הוצנחו עד כה בעזה, מ-8 מדינות שונות",https://www.c14.co.il/article/1288045,channel14,channel14,2025-08-05T19:41:05.580863+00:00,2025-08-06T16:41:24.316228+00:00
66,4,ראש הממשלה נפגש עם משלחת חברי קונגרס רפובליקנים מטעם AIPAC,https://www.c14.co.il/article/1289014,channel14,channel14,2025-08-06T16:00:00+00:00,2025-08-19T08:56:32.701749+00:00
73,4,"החזית ביו""ש: כוחותינו החרימו מאות אלפי שקלים שנועדו לטרור",https://www.c14.co.il/article/1287995,channel14,channel14,2025-08-05T15:55:05.580863+00:00,2025-08-10T10:30:16.069489+00:00
2,3,ברקע הגברת התקיפות הרוסיות: טראמפ וזלנסקי קיימו שיחת טלפון,https://www.c14.co.il/article/1288025,channel14,channel14,2025-08-05T18:55:05.577551+00:00,2025-08-19T11:35:32.701749+00:00
5,3,"טראמפ צפוי להכריז: השקעת עתק נוספת של אפל בארה""ב",https://www.c14.co.il/article/1289058,channel14,channel14,2025-08-06T18:41:24.315230+00:00,2025-08-10T11:30:16.064351+00:00
9,3,תינוקת נכוותה משמן רותח באשדוד - מצבה קשה,https://www.mako.co.il/news-israel/2025_q3/Article-aafeeeb5ebd3891027.htm,n12,n12,2025-07-24T20:00:00+00:00,2025-08-09T23:39:00+00:00
10,3,"האב השכול נגד מכתב האמנים: ""אין צבא מוסרי יותר מהצבא שלנו""",https://www.c14.co.il/article/1287681,channel14,channel14,2025-08-05T15:55:05.581867+00:00,2025-08-18T15:56:00+00:00
18,3,"הבריטים מבצעים טיסות סיור בשמי עזה, המטרה: איתור חטופים",https://www.c14.co.il/article/1288110,channel14,channel14,2025-08-05T19:11:05.576552+00:00,2025-08-06T15:41:24.316228+00:00
19,3,הכדור בידיים של נתניהו: האם ימצא זמן להכריז על ריבונות?,https://www.c14.co.il/article/1298268,channel14,channel14,2025-08-18T17:57:00+00:00,2025-08-19T11:21:32.701749+00:00
23,3,"בעקבות סרטון התבוסתנות בגל""צ: מגישת ערוץ 14 במסר ל""לשעברים""",https://www.c14.co.il/article/1287663,channel14,channel14,2025-08-05T16:55:05.581867+00:00,2025-08-19T10:56:32.701749+00:00
25,3,"הרמטכ""ל זמיר: ""תרבות המחלוקת היא חלק בלתי נפרד מההיסטוריה""",https://www.c14.co.il/article/1289524,channel14,channel14,2025-08-07T14:06:33.354212+00:00,2025-08-18T17:34:00+00:00
27,3,"האם יוכל לשוב ללשכת רה""מ? הדיון של יונתן אוריך בביהמ""ש",https://www.c14.co.il/article/1290432,channel14,channel14,2025-08-10T10:30:16.064351+00:00,2025-08-19T08:56:32.706899+00:00
28,3,תוך פחות מ-20 דקות: שני ילדים חולצו מרכבים עם סימני מכת חום,https://www.c14.co.il/article/1287940,channel14,channel14,2025-08-05T16:55:05.583865+00:00,2025-08-19T08:56:32.701749+00:00
30,3,"658 ימים בשבי | אם החטוף: ""כל פעם שאני שומעת על מנהרה מופצצת - הבטן שלי מתהפכת""",https://www.mako.co.il/news-israel/2025_q3/Article-fd28c3cc42d3891026.htm,n12,n12,2025-07-25T06:28:00+00:00,2025-08-17T15:12:00+00:00
38,3,טבריה: ילד בן 10 טבע בבריכה - מצבו קשה,https://www.c14.co.il/article/1289178,channel14,channel14,2025-08-06T18:41:24.320807+00:00,2025-08-10T10:30:16.069489+00:00
41,3,עושה זאת שוב: טראמפ רומז על כהונה שלישית - האם זה אפשרי?,https://www.c14.co.il/article/1288033,channel14,channel14,2025-08-05T18:55:05.576552+00:00,2025-08-10T12:23:16.064351+00:00
47,3,"העירייה חוגגת, הדיירים זועמים: ""טקס על החורבות שלנו""",https://www.mako.co.il/news-israel/2025_q3/Article-ba205d9e11c4891026.htm,n12,n12,2025-07-27T15:46:00+00:00,2025-07-28T09:22:00+00:00
55,3,לאחר הפרסום ב-N12: כתב אישום נגד האישה שחסמה אדם מלהיכנס למקלט,https://www.mako.co.il/news-israel/2025_q3/Article-29ee051e8307891027.htm,n12,"channel14, n12",2025-08-03T19:25:00+00:00,2025-08-07T14:06:33.354212+00:00
56,3,כיבוש הרצועה? פאנליסט הפטריוטים מפקפק בהחלטת הקבינט,https://www.c14.co.il/article/1290281,channel14,channel14,2025-08-09T20:42:00+00:00,2025-08-09T23:32:00+00:00
57,3,"ארה""ב מסמנת כיוון לריבונות: יו""ר בית הנבחרים ביקר בשומרון",https://www.c14.co.il/article/1287056,channel14,channel14,2025-08-04T18:00:00+00:00,2025-08-05T17:55:05.577551+00:00
65,3,"הטרגדיה בראשל""צ: הבנות חזרו לגג אחרי שבועיים - והפעם ""הצליחו"" לקפוץ",https://www.mako.co.il/news-israel/2025_q3/Article-caeabe149d07891027.htm,n12,n12,2025-08-03T18:00:00+00:00,2025-08-06T18:04:00+00:00
82,3,קובנה עלי זעתר: הטוויסט המרענן של יהודה עמר ורון שובל,https://www.c14.co.il/article/1289869,channel14,channel14,2025-08-09T22:48:00+00:00,2025-08-09T22:48:00+00:00
122,3,"670 יום בשבי: ""התיעודים של החטופים היו אמורים להרעיד את המדינה ולהוציא את כולם לרחובות""",https://www.mako.co.il/news-israel/2025_q3/Article-bab656366bd7891026.htm,n12,n12,2025-08-06T07:25:00+00:00,2025-08-06T19:19:00+00:00
1,2,"גדי איזנקוט: ""אני יכול להיות ראש ממשלת ישראל""",https://www.mako.co.il/news-israel/2025_q3/Article-fe4cd0f94094891027.htm,n12,"channel14, n12",2025-07-27T06:25:00+00:00,2025-07-27T06:25:00+00:00
4,2,"""חברות הסיעוד, המטפלות וביטוח לאומי - כולם יודעים"" | עוקץ הקשישים שמתבצע בחסות החוק",https://www.mako.co.il/news-israel/2025_q3/Article-4aea598d6777891027.htm,n12,"channel14, n12",2025-08-05T05:52:00+00:00,2025-08-05T17:55:05.577551+00:00
7,2,ההתערבות של הלל ביטון רוזן ושמעון ריקלין בשידור חי,https://www.c14.co.il/article/1288878,channel14,channel14,2025-08-06T15:41:24.315230+00:00,2025-08-18T13:00:00+00:00
8,2,אחרי עשרות שנים: שגרירות ישראל בזמביה נפתחת מחדש,https://www.c14.co.il/article/1298522,channel14,channel14,2025-08-19T06:56:32.701749+00:00,2025-08-19T06:56:32.701749+00:00
11,2,"662 ימים בשבי: ""דחינו את החתונה בגלל המו""מ על עסקה - ואז היא התפוצצה""",https://www.mako.co.il/news-israel/2025_q3/Article-e9c5270aee25891026.htm,n12,n12,2025-07-29T05:44:00+00:00,2025-08-07T21:01:00+00:00
12,2,טרגדיה בכביש 4: בן 37 נהרג בהתנגשות בין אופנוע לרכב,https://www.c14.co.il/article/1289480,channel14,channel14,,
16,2,השרב הקיצוני כבר כאן: כך תימנעו מפגיעות חום,https://www.c14.co.il/article/1289422,channel14,channel14,,
17,2,המועדון הגרמני שביטל את צירופו של השחקן הישראלי לשורותיו,https://www.c14.co.il/article/1287740,channel14,channel14,2025-08-04T21:09:00+00:00,2025-08-04T21:09:00+00:00
20,2,"""רמטכ""ל פוליטי"": ביקורת בליכוד נגד כ""ץ - שדחף למינוי זמיר",https://www.c14.co.il/article/1289228,channel14,channel14,2025-08-06T20:28:24.315230+00:00,2025-08-06T20:28:24.315230+00:00
21,2,ברקע החלטת הקבינט: ראש הממשלה צפוי לכנס הערב מסיבת עיתונאים,https://www.c14.co.il/article/1290544,channel14,channel14,2025-08-10T11:30:16.064351+00:00,2025-08-10T11:30:16.064351+00:00
22,2,"השרים לרמטכ""ל: הבהר שתציית להחלטת הקבינט על כיבוש רצועת עזה",https://www.c14.co.il/article/1287528,channel14,channel14,2025-08-04T20:04:00+00:00,2025-08-04T20:04:00+00:00
24,2,"שון וייסמן מגיב לסערה בגרמניה: ""תמיד אעמוד לצד העם שלי""",https://www.c14.co.il/article/1287828,channel14,channel14,2025-08-05T15:55:05.582864+00:00,2025-08-05T15:55:05.582864+00:00
26,2,"השרה האוסטרלית תוקפת את ישראל: ""פוגעת במאמצים הבינלאומיים""",https://www.c14.co.il/article/1298487,channel14,channel14,2025-08-19T06:56:32.701749+00:00,2025-08-19T06:56:32.701749+00:00
29,2,"ארה""ב: 5 חיילים נפגעו באירוע ירי בסמוך לבסיס צבאי בג'ורג'יה",https://www.c14.co.il/article/1289189,channel14,channel14,2025-08-06T19:41:24.315230+00:00,2025-08-19T04:56:00+00:00
31,2,"יאניק סינר פרש בגמר, קרלוס אלקרס זכה בסינסינטי",https://www.c14.co.il/article/1298475,channel14,channel14,2025-08-19T06:56:32.706899+00:00,2025-08-19T06:56:32.706899+00:00
33,2,"פרסום ראשון: השב""כ מונע ממתיישב עצור להשתתף בחתונת אחותו",https://www.c14.co.il/article/1287749,channel14,"channel14, n12",2025-08-05T15:55:05.580863+00:00,2025-08-08T06:40:00+00:00
36,2,"מנהיג חיזבאללה תוקף את ההצעה האמריקנית: ""לא נתפרק מנשקנו""",https://www.c14.co.il/article/1288115,channel14,channel14,2025-08-05T19:26:05.576552+00:00,2025-08-10T09:30:16.063351+00:00
37,2,"ינפץ את שיא ההעברות של הליגה: כוכב טוטנהאם עובר לארה""ב",https://www.c14.co.il/article/1288479,channel14,channel14,2025-08-06T01:54:00+00:00,2025-08-06T01:54:00+00:00
39,2,כלכלה,https://www.c14.co.il/article/article/article/article/article/1287979,channel14,channel14,,
42,2,חוק הגיוס: האם הצדדים באמת רוצים לראות אותו מגיע? // פרשנות,https://www.c14.co.il/article/1288879,channel14,channel14,2025-08-06T15:41:24.317228+00:00,2025-08-06T15:41:24.317228+00:00
44,2,אחרי הדיון על הרחבת הפעולה בעזה - מפגינים חסמו לתנועה את איילון דרום,https://www.mako.co.il/news-israel/2025_q3/Article-6ae88b9558b7891026.htm,n12,n12,2025-08-05T19:45:00+00:00,2025-08-17T07:20:00+00:00
49,2,"המסמך שחשף שחמאס מוכן לעסקה חלקית, ומה היה בפסגת פוטין-טראמפ | חדשות השבת",https://www.mako.co.il/news-israel/2025_q3/Article-5932872b543b891027.htm,n12,"channel14, n12",2025-08-16T17:56:00+00:00,2025-08-18T18:49:00+00:00
50,2,"""המשכנו לשבת שבעה בתוך שבעה"": המשפחות שאיבדו שני ילדים במלחמה",https://www.mako.co.il/news-israel/2025_q3/Article-b47ee58e86c7891026.htm,n12,"channel14, n12",2025-08-06T08:46:00+00:00,2025-08-06T18:41:24.315230+00:00
51,2,"668 ימים בשבי: ""סבא לא מאמין שהנכד שלו מתן צריך לעבור שואה 80 שנה אחריו""",https://www.mako.co.il/news-israel/2025_q3/Article-3996dc1490e6891026.htm,n12,n12,2025-08-04T07:00:00+00:00,2025-08-05T12:25:00+00:00
52,2,"בצה""ל כבר מכינים ""בנק תירוצים"" נגד כיבוש הרצועה",https://www.c14.co.il/article/1289177,channel14,channel14,2025-08-06T15:56:00+00:00,2025-08-06T20:05:24.315230+00:00
53,2,חזרו הביתה מטיול של 24 שעות – וזה מה שגילו בבית,https://www.mako.co.il/news-israel/2025_q3/Article-7edb27a16c57891027.htm,n12,"channel14, n12",2025-08-06T08:00:00+00:00,2025-08-06T08:00:00+00:00
54,2,"סערת החלפת המנעולים הגיעה לבג""ץ: לוין מתעקש - ""זה החדר האישי שלי""",https://www.mako.co.il/news-israel/2025_q3/Article-eef60ac0818b891027.htm,n12,"channel14, n12",2025-08-17T14:04:00+00:00,2025-08-19T10:56:32.701749+00:00
60,2,"תביעת הענק של משפחות קורבנות 7.10 - נגד פייסבוק: ""מראות הזוועה לנצח ייצרבו""",https://www.mako.co.il/news-israel/2025_q3/Article-40e8a4ea0b57891026.htm,n12,"channel14, n12",2025-08-04T18:45:00+00:00,2025-08-10T11:43:16.064351+00:00
61,2,"אמו של לוחם בחשמונאים: ""הם מורעלים על קדושת התורה והארץ""",https://www.c14.co.il/article/1289135,channel14,channel14,2025-08-06T18:41:24.315230+00:00,2025-08-06T18:41:24.315230+00:00
62,2,"רה""מ וראש המוסד נועדו עם חברי ועדת המודיעין של הקונגרס",https://www.c14.co.il/article/1289166,channel14,channel14,2025-08-06T16:33:00+00:00,2025-08-06T18:41:24.317228+00:00
63,2,טכנולוגיה,https://www.c14.co.il/article/article/article/article/article/article/1287967,channel14,channel14,,
64,2,צומת דרכים גורלי לישראל: הכרעת חמאס או כניעה וגרירת רגליים,https://www.c14.co.il/article/1290397,channel14,channel14,2025-08-10T07:30:16.065351+00:00,2025-08-18T17:13:00+00:00
75,2,"החרדים מאיימים: ""נצא למאבק עולמי שלא היה כמותו""",https://www.c14.co.il/article/1289180,channel14,channel14,2025-08-06T18:16:00+00:00,2025-08-06T19:41:24.315230+00:00
76,2,"אירוע מכוער ברחבת הכותל: נשים ניסו להכניס ספר תורה, סדרני המקום עצרו אותן ובמקום התפתח עימות",https://www.mako.co.il/news-israel/2025_q3/Article-f743bbc0b6f4891027.htm,n12,"channel14, n12",2025-07-28T07:09:00+00:00,2025-08-19T09:56:32.701749+00:00
77,2,הממשלה תאשר מחר: 3.3 מיליארד שקל לחיזוק אשקלון ויישובי הדרום,https://www.mako.co.il/news-israel/2025_q3/Article-936794142117891026.htm,n12,"channel14, n12",2025-08-03T19:57:00+00:00,2025-08-03T19:57:00+00:00
78,2,"פועל נהרג לאחר שנפל מגג היכל התרבות בתל אביב, נפתחה חקירה",https://www.c14.co.il/article/1287831,channel14,channel14,2025-08-05T14:55:05.586286+00:00,2025-08-05T14:55:05.586286+00:00
83,2,"גורם מדיני: ""תגובת חמאס רצינית יותר מהקודמות""",https://www.c14.co.il/article/1298146,channel14,channel14,2025-08-18T16:50:00+00:00,2025-08-19T05:23:00+00:00
85,2,כוחותינו תקפו תשתיות טרור של חיזבאללה בדרום לבנון,https://www.c14.co.il/article/1289337,channel14,channel14,2025-08-06T22:23:00+00:00,2025-08-06T22:23:00+00:00
88,2,גל חום היסטורי: ישראל בדרך לשבור שיא של 83 שנים,https://www.c14.co.il/article/1290470,channel14,channel14,2025-08-10T10:30:16.064351+00:00,2025-08-18T20:21:00+00:00
94,2,"במהפך דרמטי: מכבי ת""א גברה 1:2 על האמרון ספרטנס במלטה",https://www.c14.co.il/article/1288175,channel14,channel14,2025-08-05T21:25:00+00:00,2025-08-05T21:25:00+00:00
98,2,במשחק הכנה ליורובאסקט: נבחרת ישראל נכנעה 93:81 לאסטוניה,https://www.c14.co.il/article/1288219,channel14,channel14,2025-08-05T18:00:00+00:00,2025-08-05T18:00:00+00:00
100,2,המחבל לשעבר טוען: זו הדרך להביא לשחרור החטופים מידי חמאס,https://www.c14.co.il/article/1289040,channel14,channel14,2025-08-06T17:41:24.317228+00:00,2025-08-10T11:30:16.064351+00:00
101,2,"שופטי בג""ץ בביקורת חסרת תקדים נגד מדיניות בן גביר בבתי הכלא",https://www.c14.co.il/article/1298549,channel14,channel14,2025-08-19T07:56:32.706899+00:00,2025-08-19T11:06:32.701749+00:00
103,2,בריאות,https://www.c14.co.il/article/article/article/article/article/article/article/1287793,channel14,channel14,,
104,2,אביו של רום ברסלבסקי: רואה את הילד שלי גוסס מול העיניים ולא יכול לעשות כלום,https://www.mako.co.il/news-israel/2025_q3/Article-e0318f040017891026.htm,n12,n12,2025-08-03T20:35:00+00:00,2025-08-19T04:31:00+00:00
109,2,"הרצוג בפגישה עם נשיא אסטוניה: ""אל תפלו לשקרים של חמאס""",https://www.c14.co.il/article/1288895,channel14,channel14,2025-08-06T15:41:24.317228+00:00,2025-08-06T15:41:24.317228+00:00
111,2,חוסל מחבל שאסף מודיעין על לוחמינו בלבנון,https://www.c14.co.il/article/1290289,channel14,channel14,2025-08-09T21:00:00+00:00,2025-08-09T21:47:00+00:00
116,2,"בפעם השנייה היום: דובר צה""ל בערבית בהודעת פינוי לתושבי עזה",https://www.c14.co.il/article/1288743,channel14,channel14,,
121,2,"מרצה בכיר לחינוך: ""מי שמתגייס לסיירת מטכ""ל - רוצח""",https://www.c14.co.il/article/1289208,channel14,channel14,2025-08-06T18:55:00+00:00,2025-08-06T18:55:00+00:00
131,2,"הפגנות משפחות חטופים, הלומי קרב - ואירועי תרבות: המשטרה בכוננות שיא",https://www.mako.co.il/news-israel/2025_q3/Article-393ef57be148891026.htm,n12,n12,2025-08-07T12:27:00+00:00,2025-08-07T15:28:00+00:00
134,2,"רב חרדי שבנו בחשמונאים: ""יש מאמץ מיוחד לתת את כל התנאים""",https://www.c14.co.il/article/1289179,channel14,channel14,2025-08-06T18:00:00+00:00,2025-08-06T19:41:24.315230+00:00
34,1,"660 ימים בשבי: ""אמרתי לנתניהו – רונן הוא הבחור שנשאר בעוטף בכל מבצע צבאי ודווקא אותו הפקירו""",https://www.mako.co.il/news-israel/2025_q3/Article-a08ad0f94094891027.htm,n12,n12,2025-07-27T04:37:00+00:00,2025-07-27T04:37:00+00:00
59,1,"פיצרייה לא כשרה הותקפה במודיעין: ""קרעו תפריטים וקיללו את הסועדים""",https://www.mako.co.il/news-israel/2025_q3/Article-387d6ce84b7a891026.htm,n12,n12,2025-08-14T12:28:00+00:00,2025-08-14T12:28:00+00:00
67,1,חבר הכנסת מאיים: אם מוותרים על מטרות המלחמה - נלך לבחירות,https://www.c14.co.il/article/1290449,channel14,channel14,2025-08-10T10:30:16.066351+00:00,2025-08-10T10:30:16.066351+00:00
69,1,צום תשעה באב 2025: זמני כניסת ויציאת הצום,https://www.mako.co.il/news-israel/2024_q3/Article-75aa857e2681191027.htm,n12,n12,2025-07-27T09:33:00+00:00,2025-07-27T09:33:00+00:00
70,1,תרבות ובידור,https://www.c14.co.il/article/article/1287525,channel14,channel14,,
72,1,דווקא בשנת מלחמה - ענף הרכבים שובר שיאים,https://www.c14.co.il/article/1289503,channel14,channel14,2025-08-07T12:06:33.354212+00:00,2025-08-07T12:06:33.354212+00:00
74,1,"גל עבד באולם בהיכל התרבות בת""א, ונהרג מנפילה מגובה: ""אנו המומים""",https://www.mako.co.il/news-israel/2025_q3/Article-c195a2cdc2f7891026.htm,n12,n12,2025-08-06T12:50:00+00:00,2025-08-06T12:50:00+00:00
79,1,"ריקי בליך החתומה על עצומת האמנים: ""אני מרחמת על הילדים בעזה""",https://www.c14.co.il/article/1289416,channel14,channel14,,
80,1,ללא פציעות אך רזה: גור אריות חולץ מחצר בית בהחזקה לא חוקית,https://www.mako.co.il/news-israel/2025_q3/Article-6a3296249054891026.htm,n12,n12,2025-07-26T07:04:00+00:00,2025-07-26T07:04:00+00:00
81,1,"הח""כ מהשמאל פורש מהכנסת - ומודיע: ""לא אתמודד בבחירות הבאות""",https://www.c14.co.il/article/1290497,channel14,channel14,2025-08-10T10:30:16.064351+00:00,2025-08-10T10:30:16.064351+00:00
84,1,"חברת קבינט תקפה את הביקורת לעסקה: ""נמאס מבן גביר וסמוטריץ'""",https://www.c14.co.il/article/1298610,channel14,channel14,2025-08-19T08:56:32.701749+00:00,2025-08-19T08:56:32.701749+00:00
86,1,חריג: זו הסיבה שבגללה נפסל השער של קריסטל פאלאס מול צ'לסי,https://www.c14.co.il/article/1297798,channel14,channel14,2025-08-18T11:35:00+00:00,2025-08-18T11:35:00+00:00
87,1,מטיילים ביוון? הפגנות אנטי-ישראליות צפויות ברחבי המדינה,https://www.c14.co.il/article/1290594,channel14,channel14,2025-08-10T11:35:16.064351+00:00,2025-08-10T11:35:16.064351+00:00
89,1,קים ג'ונג און מאיים להגדיל את הארסנל הגרעיני של צפון קוריאה,https://www.c14.co.il/article/1298896,channel14,channel14,2025-08-19T11:19:32.701749+00:00,2025-08-19T11:19:32.701749+00:00
90,1,"""מלכודת מוות"": נועם ז""ל נהרג בתאונת אופנוע, משפחתו תובעת מיליונים מהמועצה המקומית",https://www.mako.co.il/news-israel/2025_q3/Article-5068fa6f2655891026.htm,n12,n12,2025-07-29T16:14:00+00:00,2025-07-29T16:14:00+00:00
91,1,"צדק תרדוף: ביתו של המחבל שרצח את יהושע שמחה הי""ד ייהרס",https://www.c14.co.il/article/1298334,channel14,channel14,2025-08-18T19:20:00+00:00,2025-08-18T19:20:00+00:00
92,1,"""המכה הבאה תהיה הרבה יותר קשה"": השר ברקת באיום ישיר לאיראן",https://www.c14.co.il/article/1297915,channel14,channel14,2025-08-18T14:28:00+00:00,2025-08-18T14:28:00+00:00
93,1,דווקא עכשיו: חופים בתל אביב ייסגרו באמצע הקיץ בגלל מחסור במצילים,https://www.mako.co.il/news-israel/2025_q3/Article-ced242b93ba4891027.htm,n12,n12,2025-07-27T08:11:00+00:00,2025-07-27T08:11:00+00:00
95,1,"לשכת רה""מ: ""צה״ל ערוך למימוש כל החלטה שתתקבל""",https://www.c14.co.il/article/1288058,channel14,channel14,2025-08-05T18:55:05.577551+00:00,2025-08-05T18:55:05.577551+00:00
96,1,ספורט,https://www.c14.co.il/article/article/article/article/1287990,channel14,channel14,,
97,1,"האסון בביה""ח אסף הרופא: בן 35 יצא לקנות מים לאשתו ההרה - ונהרג מקריסת עץ",https://www.mako.co.il/news-israel/2025_q3/Article-5f0aaf81d025891026.htm,n12,n12,2025-07-28T18:22:00+00:00,2025-07-28T18:22:00+00:00
99,1,"אורן סמדג'ה פותח הכול בריאיון מיוחד: על החיים כאב שכול, הסיבה שעזב את איגוד הג'ודו - והאם נראה אותו בפוליטיקה?",https://www.mako.co.il/news-israel/2025_q3/Article-a2f8244eb4f3891026.htm,n12,n12,2025-07-25T12:05:00+00:00,2025-07-25T12:05:00+00:00
102,1,"גידי גוב סירב להגיב על מכתב האומנים ב""סטורי לילה"" - וניתק",https://www.c14.co.il/article/1288368,channel14,channel14,,
